{
  "schemaVersion": 1,
  "manifestRevision": 1,
  "rotationEditionV2": "enabled",
  "dispositions": [
    {"key":"choice.arrival@v1","status":"reviewed","changedOn":"2026-08-19","reviewRef":"SYNTHETIC-TEST-REVIEW"},
    {"key":"link.orientation@v1","status":"blocked","changedOn":"2026-08-19","reviewRef":"SYNTHETIC-TEST-REVIEW"},
    {"key":"location.example-unit@v1","status":"reviewed","changedOn":"2026-08-19","reviewRef":"SYNTHETIC-TEST-REVIEW"},
    {"key":"place.example-workroom@v1","status":"pending","changedOn":"2026-08-19","reviewRef":"SYNTHETIC-TEST-REVIEW"},
    {"key":"profile.example-attending@v1","status":"deprecated","changedOn":"2026-08-19","reviewRef":"SYNTHETIC-TEST-REVIEW"},
    {"key":"synthetic.choice.access-one@v1","status":"reviewed","changedOn":"2026-08-19","reviewRef":"SYNTHETIC-TEST-REVIEW"},
    {"key":"synthetic.choice.access-two@v1","status":"reviewed","changedOn":"2026-08-19","reviewRef":"SYNTHETIC-TEST-REVIEW"},
    {"key":"synthetic.choice.activity-one@v1","status":"reviewed","changedOn":"2026-08-19","reviewRef":"SYNTHETIC-TEST-REVIEW"},
    {"key":"synthetic.choice.activity-two@v1","status":"reviewed","changedOn":"2026-08-19","reviewRef":"SYNTHETIC-TEST-REVIEW"},
    {"key":"synthetic.choice.blocked-reason@v1","status":"blocked","changedOn":"2026-08-19","reviewRef":"SYNTHETIC-TEST-REVIEW"},
    {"key":"synthetic.choice.checklist-one@v1","status":"reviewed","changedOn":"2026-08-19","reviewRef":"SYNTHETIC-TEST-REVIEW"},
    {"key":"synthetic.choice.checklist-two@v1","status":"reviewed","changedOn":"2026-08-19","reviewRef":"SYNTHETIC-TEST-REVIEW"},
    {"key":"synthetic.choice.day-set-one@v1","status":"reviewed","changedOn":"2026-08-19","reviewRef":"SYNTHETIC-TEST-REVIEW"},
    {"key":"synthetic.choice.day-set-two@v1","status":"reviewed","changedOn":"2026-08-19","reviewRef":"SYNTHETIC-TEST-REVIEW"},
    {"key":"synthetic.choice.deprecated-reason@v1","status":"deprecated","changedOn":"2026-08-19","reviewRef":"SYNTHETIC-TEST-REVIEW"},
    {"key":"synthetic.choice.documentation-timing@v1","status":"reviewed","changedOn":"2026-08-19","reviewRef":"SYNTHETIC-TEST-REVIEW"},
    {"key":"synthetic.choice.documentation-workflow@v1","status":"reviewed","changedOn":"2026-08-19","reviewRef":"SYNTHETIC-TEST-REVIEW"},
    {"key":"synthetic.choice.due-one@v1","status":"reviewed","changedOn":"2026-08-19","reviewRef":"SYNTHETIC-TEST-REVIEW"},
    {"key":"synthetic.choice.due-two@v1","status":"reviewed","changedOn":"2026-08-19","reviewRef":"SYNTHETIC-TEST-REVIEW"},
    {"key":"synthetic.choice.feedback-cadence@v1","status":"reviewed","changedOn":"2026-08-19","reviewRef":"SYNTHETIC-TEST-REVIEW"},
    {"key":"synthetic.choice.feedback-initiator@v1","status":"reviewed","changedOn":"2026-08-19","reviewRef":"SYNTHETIC-TEST-REVIEW"},
    {"key":"synthetic.choice.feedback-setting@v1","status":"reviewed","changedOn":"2026-08-19","reviewRef":"SYNTHETIC-TEST-REVIEW"},
    {"key":"synthetic.choice.presentation-element-one@v1","status":"reviewed","changedOn":"2026-08-19","reviewRef":"SYNTHETIC-TEST-REVIEW"},
    {"key":"synthetic.choice.presentation-element-two@v1","status":"reviewed","changedOn":"2026-08-19","reviewRef":"SYNTHETIC-TEST-REVIEW"},
    {"key":"synthetic.choice.presentation-format@v1","status":"reviewed","changedOn":"2026-08-19","reviewRef":"SYNTHETIC-TEST-REVIEW"},
    {"key":"synthetic.choice.presentation-timing@v1","status":"reviewed","changedOn":"2026-08-19","reviewRef":"SYNTHETIC-TEST-REVIEW"},
    {"key":"synthetic.choice.reason-one@v1","status":"reviewed","changedOn":"2026-08-19","reviewRef":"SYNTHETIC-TEST-REVIEW"},
    {"key":"synthetic.choice.reason-two@v1","status":"reviewed","changedOn":"2026-08-19","reviewRef":"SYNTHETIC-TEST-REVIEW"},
    {"key":"synthetic.choice.role-one@v1","status":"reviewed","changedOn":"2026-08-19","reviewRef":"SYNTHETIC-TEST-REVIEW"},
    {"key":"synthetic.choice.role-two@v1","status":"reviewed","changedOn":"2026-08-19","reviewRef":"SYNTHETIC-TEST-REVIEW"},
    {"key":"synthetic.choice.rounds-follow-up@v1","status":"reviewed","changedOn":"2026-08-19","reviewRef":"SYNTHETIC-TEST-REVIEW"},
    {"key":"synthetic.choice.rounds-participation@v1","status":"reviewed","changedOn":"2026-08-19","reviewRef":"SYNTHETIC-TEST-REVIEW"},
    {"key":"synthetic.choice.rounds-preparation@v1","status":"reviewed","changedOn":"2026-08-19","reviewRef":"SYNTHETIC-TEST-REVIEW"},
    {"key":"synthetic.curator@v1","status":"reviewed","changedOn":"2026-08-19","reviewRef":"SYNTHETIC-TEST-REVIEW"},
    {"key":"synthetic.link.access-one@v1","status":"reviewed","changedOn":"2026-08-19","reviewRef":"SYNTHETIC-TEST-REVIEW"},
    {"key":"synthetic.link.access-two@v1","status":"reviewed","changedOn":"2026-08-19","reviewRef":"SYNTHETIC-TEST-REVIEW"},
    {"key":"synthetic.link.arrival@v1","status":"reviewed","changedOn":"2026-08-19","reviewRef":"SYNTHETIC-TEST-REVIEW"},
    {"key":"synthetic.link.attendance@v1","status":"reviewed","changedOn":"2026-08-19","reviewRef":"SYNTHETIC-TEST-REVIEW"},
    {"key":"synthetic.link.cross-location@v1","status":"reviewed","changedOn":"2026-08-19","reviewRef":"SYNTHETIC-TEST-REVIEW"},
    {"key":"synthetic.link.directory-one@v1","status":"reviewed","changedOn":"2026-08-19","reviewRef":"SYNTHETIC-TEST-REVIEW"},
    {"key":"synthetic.link.directory-two@v1","status":"reviewed","changedOn":"2026-08-19","reviewRef":"SYNTHETIC-TEST-REVIEW"},
    {"key":"synthetic.link.documentation@v1","status":"reviewed","changedOn":"2026-08-19","reviewRef":"SYNTHETIC-TEST-REVIEW"},
    {"key":"synthetic.link.feedback@v1","status":"reviewed","changedOn":"2026-08-19","reviewRef":"SYNTHETIC-TEST-REVIEW"},
    {"key":"synthetic.link.resource@v1","status":"reviewed","changedOn":"2026-08-19","reviewRef":"SYNTHETIC-TEST-REVIEW"},
    {"key":"synthetic.location.alternate@v1","status":"reviewed","changedOn":"2026-08-19","reviewRef":"SYNTHETIC-TEST-REVIEW"},
    {"key":"synthetic.location.primary@v1","status":"reviewed","changedOn":"2026-08-19","reviewRef":"SYNTHETIC-TEST-REVIEW"},
    {"key":"synthetic.phrases@v1","status":"reviewed","changedOn":"2026-08-19","reviewRef":"SYNTHETIC-TEST-REVIEW"},
    {"key":"synthetic.place.alternate@v1","status":"reviewed","changedOn":"2026-08-19","reviewRef":"SYNTHETIC-TEST-REVIEW"},
    {"key":"synthetic.place.one@v1","status":"reviewed","changedOn":"2026-08-19","reviewRef":"SYNTHETIC-TEST-REVIEW"},
    {"key":"synthetic.place.two@v1","status":"reviewed","changedOn":"2026-08-19","reviewRef":"SYNTHETIC-TEST-REVIEW"},
    {"key":"synthetic.preset.full@v1","status":"reviewed","changedOn":"2026-08-19","reviewRef":"SYNTHETIC-TEST-REVIEW"}
  ]
}
